{
  "schemaVersion": 1,
  "id": "midnight",
  "name": "Midnight",
  "version": "1.0.0",
  "license": "MPL-2.0",
  "capabilities": [
    "theme"
  ],
  "minAppVersion": "1.0.0",
  "checksums": {
    "theme.json": "aaaaaaaaaaaaaaaaaaaaaaaaaaaaaaaaaaaaaaaaaaaaaaaaaaaaaaaaaaaaaaaa",
    "LICENSE": "bbbbbbbbbbbbbbbbbbbbbbbbbbbbbbbbbbbbbbbbbbbbbbbbbbbbbbbbbbbbbbbb",
    "preview.png": "cccccccccccccccccccccccccccccccccccccccccccccccccccccccccccccccc",
    "C:\\evil.dll": "ffffffffffffffffffffffffffffffffffffffffffffffffffffffffffffffff"
  }
}
